{
  "schemaVersion": 2,
  "task": "SEC-03",
  "architectureSha256": "1985ef61f9de682bfd04b60eba2f7cc9a44f4541394f04d08f826ff2356737fe",
  "candidateBinding": "runtime",
  "layers": [
    "real-host",
    "electron",
    "packaged"
  ],
  "profiles": [
    "E1",
    "E2",
    "E3",
    "E3A",
    "E4"
  ],
  "realHostReceiptCount": 386,
  "projectionReceiptCountPerLayer": 48,
  "runtimeReceiptCount": 482,
  "records": [
    {
      "layer": "real-host",
      "familyId": "A01",
      "variantId": "A01-01",
      "profileId": "E1",
      "stimulus": {
        "descriptor": "deepseek-api-key",
        "sourceVariant": null
      },
      "expectedCode": "OBS_ENV_ABSENT",
      "expectedSubcode": null,
      "nativeProducerRequired": true
    },
    {
      "layer": "real-host",
      "familyId": "A01",
      "variantId": "A01-01",
      "profileId": "E2",
      "stimulus": {
        "descriptor": "deepseek-api-key",
        "sourceVariant": null
      },
      "expectedCode": "OBS_ENV_ABSENT",
      "expectedSubcode": null,
      "nativeProducerRequired": true
    },
    {
      "layer": "real-host",
      "familyId": "A01",
      "variantId": "A01-01",
      "profileId": "E3",
      "stimulus": {
        "descriptor": "deepseek-api-key",
        "sourceVariant": null
      },
      "expectedCode": "OBS_ENV_ABSENT",
      "expectedSubcode": null,
      "nativeProducerRequired": true
    },
    {
      "layer": "real-host",
      "familyId": "A01",
      "variantId": "A01-01",
      "profileId": "E4",
      "stimulus": {
        "descriptor": "deepseek-api-key",
        "sourceVariant": null
      },
      "expectedCode": "OBS_ENV_ABSENT",
      "expectedSubcode": null,
      "nativeProducerRequired": true
    },
    {
      "layer": "real-host",
      "familyId": "A01",
      "variantId": "A01-02",
      "profileId": "E1",
      "stimulus": {
        "descriptor": "mini-lux-api-token",
        "sourceVariant": null
      },
      "expectedCode": "OBS_ENV_ABSENT",
      "expectedSubcode": null,
      "nativeProducerRequired": true
    },
    {
      "layer": "real-host",
      "familyId": "A01",
      "variantId": "A01-02",
      "profileId": "E2",
      "stimulus": {
        "descriptor": "mini-lux-api-token",
        "sourceVariant": null
      },
      "expectedCode": "OBS_ENV_ABSENT",
      "expectedSubcode": null,
      "nativeProducerRequired": true
    },
    {
      "layer": "real-host",
      "familyId": "A01",
      "variantId": "A01-02",
      "profileId": "E3",
      "stimulus": {
        "descriptor": "mini-lux-api-token",
        "sourceVariant": null
      },
      "expectedCode": "OBS_ENV_ABSENT",
      "expectedSubcode": null,
      "nativeProducerRequired": true
    },
    {
      "layer": "real-host",
      "familyId": "A01",
      "variantId": "A01-02",
      "profileId": "E4",
      "stimulus": {
        "descriptor": "mini-lux-api-token",
        "sourceVariant": null
      },
      "expectedCode": "OBS_ENV_ABSENT",
      "expectedSubcode": null,
      "nativeProducerRequired": true
    },
    {
      "layer": "real-host",
      "familyId": "A01",
      "variantId": "A01-03",
      "profileId": "E1",
      "stimulus": {
        "descriptor": "aws-secret-access-key",
        "sourceVariant": null
      },
      "expectedCode": "OBS_ENV_ABSENT",
      "expectedSubcode": null,
      "nativeProducerRequired": true
    },
    {
      "layer": "real-host",
      "familyId": "A01",
      "variantId": "A01-03",
      "profileId": "E2",
      "stimulus": {
        "descriptor": "aws-secret-access-key",
        "sourceVariant": null
      },
      "expectedCode": "OBS_ENV_ABSENT",
      "expectedSubcode": null,
      "nativeProducerRequired": true
    },
    {
      "layer": "real-host",
      "familyId": "A01",
      "variantId": "A01-03",
      "profileId": "E3",
      "stimulus": {
        "descriptor": "aws-secret-access-key",
        "sourceVariant": null
      },
      "expectedCode": "OBS_ENV_ABSENT",
      "expectedSubcode": null,
      "nativeProducerRequired": true
    },
    {
      "layer": "real-host",
      "familyId": "A01",
      "variantId": "A01-03",
      "profileId": "E4",
      "stimulus": {
        "descriptor": "aws-secret-access-key",
        "sourceVariant": null
      },
      "expectedCode": "OBS_ENV_ABSENT",
      "expectedSubcode": null,
      "nativeProducerRequired": true
    },
    {
      "layer": "real-host",
      "familyId": "A01",
      "variantId": "A01-04",
      "profileId": "E1",
      "stimulus": {
        "descriptor": "ssh-auth-sock",
        "sourceVariant": null
      },
      "expectedCode": "OBS_ENV_ABSENT",
      "expectedSubcode": null,
      "nativeProducerRequired": true
    },
    {
      "layer": "real-host",
      "familyId": "A01",
      "variantId": "A01-04",
      "profileId": "E2",
      "stimulus": {
        "descriptor": "ssh-auth-sock",
        "sourceVariant": null
      },
      "expectedCode": "OBS_ENV_ABSENT",
      "expectedSubcode": null,
      "nativeProducerRequired": true
    },
    {
      "layer": "real-host",
      "familyId": "A01",
      "variantId": "A01-04",
      "profileId": "E3",
      "stimulus": {
        "descriptor": "ssh-auth-sock",
        "sourceVariant": null
      },
      "expectedCode": "OBS_ENV_ABSENT",
      "expectedSubcode": null,
      "nativeProducerRequired": true
    },
    {
      "layer": "real-host",
      "familyId": "A01",
      "variantId": "A01-04",
      "profileId": "E4",
      "stimulus": {
        "descriptor": "ssh-auth-sock",
        "sourceVariant": null
      },
      "expectedCode": "OBS_ENV_ABSENT",
      "expectedSubcode": null,
      "nativeProducerRequired": true
    },
    {
      "layer": "real-host",
      "familyId": "A01",
      "variantId": "A01-05",
      "profileId": "E1",
      "stimulus": {
        "descriptor": "parent-sentinel",
        "sourceVariant": null
      },
      "expectedCode": "OBS_ENV_ABSENT",
      "expectedSubcode": null,
      "nativeProducerRequired": true
    },
    {
      "layer": "real-host",
      "familyId": "A01",
      "variantId": "A01-05",
      "profileId": "E2",
      "stimulus": {
        "descriptor": "parent-sentinel",
        "sourceVariant": null
      },
      "expectedCode": "OBS_ENV_ABSENT",
      "expectedSubcode": null,
      "nativeProducerRequired": true
    },
    {
      "layer": "real-host",
      "familyId": "A01",
      "variantId": "A01-05",
      "profileId": "E3",
      "stimulus": {
        "descriptor": "parent-sentinel",
        "sourceVariant": null
      },
      "expectedCode": "OBS_ENV_ABSENT",
      "expectedSubcode": null,
      "nativeProducerRequired": true
    },
    {
      "layer": "real-host",
      "familyId": "A01",
      "variantId": "A01-05",
      "profileId": "E4",
      "stimulus": {
        "descriptor": "parent-sentinel",
        "sourceVariant": null
      },
      "expectedCode": "OBS_ENV_ABSENT",
      "expectedSubcode": null,
      "nativeProducerRequired": true
    },
    {
      "layer": "real-host",
      "familyId": "A01",
      "variantId": "A01-06",
      "profileId": "E1",
      "stimulus": {
        "descriptor": "http-proxy",
        "sourceVariant": null
      },
      "expectedCode": "OBS_ENV_ABSENT",
      "expectedSubcode": null,
      "nativeProducerRequired": true
    },
    {
      "layer": "real-host",
      "familyId": "A01",
      "variantId": "A01-06",
      "profileId": "E2",
      "stimulus": {
        "descriptor": "http-proxy",
        "sourceVariant": null
      },
      "expectedCode": "OBS_ENV_ABSENT",
      "expectedSubcode": null,
      "nativeProducerRequired": true
    },
    {
      "layer": "real-host",
      "familyId": "A01",
      "variantId": "A01-06",
      "profileId": "E3",
      "stimulus": {
        "descriptor": "http-proxy",
        "sourceVariant": null
      },
      "expectedCode": "OBS_ENV_ABSENT",
      "expectedSubcode": null,
      "nativeProducerRequired": true
    },
    {
      "layer": "real-host",
      "familyId": "A01",
      "variantId": "A01-06",
      "profileId": "E4",
      "stimulus": {
        "descriptor": "http-proxy",
        "sourceVariant": null
      },
      "expectedCode": "OBS_ENV_ABSENT",
      "expectedSubcode": null,
      "nativeProducerRequired": true
    },
    {
      "layer": "real-host",
      "familyId": "A01",
      "variantId": "A01-07",
      "profileId": "E1",
      "stimulus": {
        "descriptor": "node-options",
        "sourceVariant": null
      },
      "expectedCode": "OBS_ENV_ABSENT",
      "expectedSubcode": null,
      "nativeProducerRequired": true
    },
    {
      "layer": "real-host",
      "familyId": "A01",
      "variantId": "A01-07",
      "profileId": "E2",
      "stimulus": {
        "descriptor": "node-options",
        "sourceVariant": null
      },
      "expectedCode": "OBS_ENV_ABSENT",
      "expectedSubcode": null,
      "nativeProducerRequired": true
    },
    {
      "layer": "real-host",
      "familyId": "A01",
      "variantId": "A01-07",
      "profileId": "E3",
      "stimulus": {
        "descriptor": "node-options",
        "sourceVariant": null
      },
      "expectedCode": "OBS_ENV_ABSENT",
      "expectedSubcode": null,
      "nativeProducerRequired": true
    },
    {
      "layer": "real-host",
      "familyId": "A01",
      "variantId": "A01-07",
      "profileId": "E4",
      "stimulus": {
        "descriptor": "node-options",
        "sourceVariant": null
      },
      "expectedCode": "OBS_ENV_ABSENT",
      "expectedSubcode": null,
      "nativeProducerRequired": true
    },
    {
      "layer": "real-host",
      "familyId": "A01",
      "variantId": "A01-08",
      "profileId": "E1",
      "stimulus": {
        "descriptor": "parent-path-entry",
        "sourceVariant": null
      },
      "expectedCode": "OBS_ENV_ABSENT",
      "expectedSubcode": null,
      "nativeProducerRequired": true
    },
    {
      "layer": "real-host",
      "familyId": "A01",